Title,Link,Keywords
Mice in Bion-M 1 space mission: training and selection,https://www.ncbi.nlm.nih.gov/pmc/articles/PMC4136787/,"selection, training, mission"
"Microgravity induces pelvic bone loss through osteoclastic activity, osteocytic osteolysis, and osteoblastic cell cycle inhibition by CDKN1a/p21",https://www.ncbi.nlm.nih.gov/pmc/articles/PMC3630201/,"pelvic, osteoclastic, cycle"
Stem Cell Health and Tissue Regeneration in Microgravity,https://www.ncbi.nlm.nih.gov/pmc/articles/PMC11988870/,"regeneration, stem, microgravity"
Microgravity Reduces the Differentiation and Regenerative Potential of Embryonic Stem Cells,https://www.ncbi.nlm.nih.gov/pmc/articles/PMC7998608/,"stem, cells, embryonic"
Microgravity validation of a novel system for RNA isolation and multiplex quantitative real time PCR analysis of gene expression on the International Space Station,https://www.ncbi.nlm.nih.gov/pmc/articles/PMC5587110/,"system, quantitative, real"
Spaceflight Modulates the Expression of Key Oxidative Stress and Cell Cycle Related Genes in Heart,https://www.ncbi.nlm.nih.gov/pmc/articles/PMC8396460/,"expression, modulates, genes"
Dose- and Ion-Dependent Effects in the Oxidative Stress Response to Space-Like Radiation Exposure in the Skeletal System,https://www.ncbi.nlm.nih.gov/pmc/articles/PMC5666799/,"exposure, ion-dependent, radiation"
From the bench to exploration medicine: NASA life sciences translational research for human exploration and habitation missions.,https://www.ncbi.nlm.nih.gov/pmc/articles/PMC5460236/,"missions, habitation, translational"
High-precision method for cyclic loading of small-animal vertebrae to assess bone quality.,https://www.ncbi.nlm.nih.gov/pmc/articles/PMC6222041/,"small-animal, assess, loading"
Effects of ex vivo ionizing radiation on collagen structure and whole-bone mechanical properties of mouse vertebrae.,https://www.ncbi.nlm.nih.gov/pmc/articles/PMC6813909/,"properties, vertebrae, vivo"
Absence of gamma-sarcoglycan alters the response of p70S6 kinase to mechanical perturbation in murine skeletal muscle,https://www.ncbi.nlm.nih.gov/pmc/articles/PMC4095884/,"muscle, response, kinase"
AtRabD2b and AtRabD2c have overlapping functions in pollen development and pollen tube growth.,https://www.ncbi.nlm.nih.gov/pmc/articles/PMC3040128/,"pollen, atrabd2b, development"
TNO1 is involved in salt tolerance and vacuolar trafficking in Arabidopsis.,https://www.ncbi.nlm.nih.gov/pmc/articles/PMC3177255/,"tno1, salt, tolerance"
Functional redundancy between trans-Golgi network SNARE family members in Arabidopsis thaliana.,https://www.ncbi.nlm.nih.gov/pmc/articles/PMC11500582/,"network, members, snare"
Root growth movements: Waving and skewing.,https://www.ncbi.nlm.nih.gov/pmc/articles/PMC5387210/,"root, growth, movements"
Gravitropism and lateral root emergence are dependent on the trans-Golgi network protein TNO1,https://www.ncbi.nlm.nih.gov/pmc/articles/PMC4642138/,"protein, dependent, network"
"TNO1, a TGN-localized SNARE-interacting protein, modulates root skewing in Arabidopsis thaliana.",https://www.ncbi.nlm.nih.gov/pmc/articles/PMC5387210/,"protein, modulates, arabidopsis"
The Drosophila SUN protein Spag4 cooperates with the coiled-coil protein Yuri Gagarin to maintain association of the basal body and spermatid nucleus.,https://www.ncbi.nlm.nih.gov/pmc/articles/PMC2915878/,"maintain, spag4, protein"
Toll mediated infection response is altered by gravity and spaceflight in Drosophila,https://www.ncbi.nlm.nih.gov/pmc/articles/PMC3901686/,"drosophila, toll, response"
Multi-omics analysis of multiple missions to space reveal a theme of lipid dysregulation in mouse liver,https://www.ncbi.nlm.nih.gov/pmc/articles/PMC6985101/,"lipid, mouse, dysregulation"
GeneLab database analyses suggest long-term impact of space radiation on the cardiovascular system by the activation of FYN through reactive oxygen species.,https://www.ncbi.nlm.nih.gov/pmc/articles/PMC6387434/,"space, species, through"
FAIRness and usability for open-access omics data systems.,https://www.ncbi.nlm.nih.gov/pmc/articles/PMC6371294/,"systems, omics, data"
NASA GeneLab platform utilized for biological response to space radiation in animal models,https://www.ncbi.nlm.nih.gov/pmc/articles/PMC7072278/,"response, utilized, radiation"
Circulating miRNA spaceflight signature reveals targets for countermeasure development,https://www.ncbi.nlm.nih.gov/pmc/articles/PMC8441986/,"signature, reveals, circulating"
Machine learning algorithm to characterize antimicrobial resistance associated with the International Space Station surface microbiome,https://www.ncbi.nlm.nih.gov/pmc/articles/PMC9400218/,"characterize, algorithm, antimicrobial"
Extraterrestrial Gynecology: Could Spaceflight Increase the Risk of Developing Cancer in Female Astronauts? An Updated Review,https://www.ncbi.nlm.nih.gov/pmc/articles/PMC9267413/,"increase, risk, review"
Muscle atrophy phenotype gene expression during spaceflight is linked to a metabolic crosstalk in both the liver and the muscle in mice.,https://www.ncbi.nlm.nih.gov/pmc/articles/PMC9576569/,"crosstalk, liver, mice"
Chromosomal positioning and epigenetic architecture influence DNA methylation patterns triggered by galactic cosmic radiation,https://www.ncbi.nlm.nih.gov/pmc/articles/PMC10789781/,"chromosomal, patterns, radiation"
"A comprehensive SARS-CoV-2 and COVID-19 review, Part 2: Host extracellular to systemic effects of SARS-CoV-2 infection",https://www.ncbi.nlm.nih.gov/pmc/articles/PMC10772081/,"covid-19, extracellular, systemic"
Aging and putative frailty biomarkers are altered by spaceflight,https://www.ncbi.nlm.nih.gov/pmc/articles/PMC11166946/,"biomarkers, frailty, aging"
Space radiation damage rescued by inhibition of key spaceflight associated miRNAs,https://www.ncbi.nlm.nih.gov/pmc/articles/PMC11166944/,"mirnas, radiation, associated"
Ethical considerations for the age of non-governmental space exploration,https://www.ncbi.nlm.nih.gov/pmc/articles/PMC11166968/,"considerations, exploration, space"
Innate immune responses of Drosophila melanogaster are altered by spaceflight.,https://www.ncbi.nlm.nih.gov/pmc/articles/PMC7000411/,"altered, spaceflight, innate"
Prolonged Exposure to Microgravity Reduces Cardiac Contractility and Initiates Remodeling in Drosophila,https://www.ncbi.nlm.nih.gov/pmc/articles/PMC7787258/,"prolonged, reduces, microgravity"
Regulation of plant gravity sensing and signaling by the actin cytoskeleton.,https://www.ncbi.nlm.nih.gov/pmc/articles/PMC8716943/,"signaling, actin, cytoskeleton"
HLB1 Is a Tetratricopeptide Repeat Domain-Containing Protein That Operates at the Intersection of the Exocytic and Endocytic Pathways at the TGN/EE in Arabidopsis,https://www.ncbi.nlm.nih.gov/pmc/articles/PMC4826010/,"repeat, arabidopsis, hlb1"
ERULUS is a plasma membrane-localized receptor-like kinase that specifies root hair growth by maintaining tip-focused cytoplasmic calcium oscillations.,https://www.ncbi.nlm.nih.gov/pmc/articles/PMC6048781/,"maintaining, oscillations, growth"
Brassinosteroids inhibit autotropic root straightening by modifying filamentous-actin organization and dynamics.,https://www.ncbi.nlm.nih.gov/pmc/articles/PMC7010715/,"autotropic, straightening, modifying"
Cell type-specific imaging of calcium signaling in Arabidopsis thaliana seedling roots using GCaMP3.,https://www.ncbi.nlm.nih.gov/pmc/articles/PMC7503278/,"seedling, cell, signaling"
Spatial and temporal localization of SPIRRIG and WAVE/SCAR reveal roles for these proteins in actin-mediated root hair development.,https://www.ncbi.nlm.nih.gov/pmc/articles/PMC8364238/,"proteins, spatial, these"
Microgravity Stress: Bone and Connective Tissue,https://www.ncbi.nlm.nih.gov/pmc/articles/PMC11579474/,"bone, connective, microgravity"
S. aureus MscL is a pentamer in vivo but of variable stoichiometries in vitro: implications for detergent-solubilized membrane proteins,https://www.ncbi.nlm.nih.gov/pmc/articles/PMC2998437/,"implications, proteins, membrane"
Manipulating the permeation of charged compounds through the MscL nanovalve.,https://www.ncbi.nlm.nih.gov/pmc/articles/PMC3005423/,"charged, nanovalve, compounds"
The oligomeric state of the truncated mechanosensitive channel of large conductance shows no variance in vivo.,https://www.ncbi.nlm.nih.gov/pmc/articles/PMC3190158/,"vivo, oligomeric, channel"
Three routes to modulate the pore size of the MscL channel/nanovalve,https://www.ncbi.nlm.nih.gov/pmc/articles/PMC3289768/,"three, routes, channel/nanovalve"
The dynamics of protein-protein interactions between domains of MscL at the cytoplasmic-lipid interface,https://www.ncbi.nlm.nih.gov/pmc/articles/PMC3508904/,"mscl, cytoplasmic-lipid, dynamics"
The MscS and MscL families of mechanosensitive channels act as microbial emergency release valves,https://www.ncbi.nlm.nih.gov/pmc/articles/PMC3430326/,"families, mscl, channels"
Chimeras reveal a single lipid-interface residue that controls MscL channel kinetics as well as mechanosensitivity,https://www.ncbi.nlm.nih.gov/pmc/articles/PMC3593973/,"mscl, that, lipid-interface"
Evidence for extensive horizontal gene transfer from the draft genome of a tardigrade,https://www.ncbi.nlm.nih.gov/pmc/articles/PMC5018776/,"gene, extensive, horizontal"
Reply to Bemm et al. and Arakawa: Identifying foreign genes in independent Hypsibius dujardini genome assemblies,https://www.ncbi.nlm.nih.gov/pmc/articles/PMC4896697/,"genome, hypsibius, identifying"
Tardigrades Use Intrinsically Disordered Proteins to Survive Desiccation.,https://www.ncbi.nlm.nih.gov/pmc/articles/PMC11127935/,"survive, proteins, desiccation"
Desiccation of Hypsibius exemplaris,https://www.ncbi.nlm.nih.gov/pmc/articles/PMC11831363/,"exemplaris, hypsibius, desiccation"
The biology of tardigrade disordered proteins in extreme stress tolerance.,https://www.ncbi.nlm.nih.gov/pmc/articles/PMC11930778/,"disordered, tardigrade, stress"
Production of reactive oxygen species and involvement of bioprotectants during anhydrobiosis in the tardigrade Paramacrobiotus spatialis,https://www.ncbi.nlm.nih.gov/pmc/articles/PMC8816950/,"involvement, oxygen, paramacrobiotus"
Partial weight suspension: A novel murine model for investigating adaptation to reduced musculoskeletal loading.,https://www.ncbi.nlm.nih.gov/pmc/articles/PMC3774184/,"reduced, adaptation, investigating"
"Partial reductions in mechanical loading yield proportional changes in bone density, bone architecture, and muscle mass",https://www.ncbi.nlm.nih.gov/pmc/articles/PMC4118556/,"density, bone, muscle"
Spaceflight and hind limb unloading induce similar changes in electrical impedance characteristics of mouse gastrocnemius muscle,https://www.ncbi.nlm.nih.gov/pmc/articles/PMC4653813/,"limb, induce, impedance"
Spaceflight Activates Lipotoxic Pathways in Mouse Liver,https://www.ncbi.nlm.nih.gov/pmc/articles/PMC6915713/,"activates, mouse, spaceflight"
Treatment with a soluble bone morphogenetic protein type 1A receptor (BMPR1A) fusion protein increases bone mass and bone formation in mice subjected to hindlimb unloading.,https://www.ncbi.nlm.nih.gov/pmc/articles/PMC6124165/,"protein, bone, formation"
RNAseq and RNA molecular barcoding reveal differential gene expression in cortical bone following hindlimb unloading in female mice,https://www.ncbi.nlm.nih.gov/pmc/articles/PMC8509868/,"unloading, differential, reveal"
Proteomic and phosphoproteomic characterization of cardiovascular tissues after long term exposure to simulated space radiation,https://www.ncbi.nlm.nih.gov/pmc/articles/PMC11063234/,"tissues, space, cardiovascular"
Adaptive Changes in the Vestibular System of Land Snail to a 30-Day Spaceflight and Readaptation on Return to Earth,https://www.ncbi.nlm.nih.gov/pmc/articles/PMC5672023/,"vestibular, snail, readaptation"
"Morphology of the Utricular Otolith Organ in the Toadfish, Opsanus tau",https://www.ncbi.nlm.nih.gov/pmc/articles/PMC5899691/,"toadfish, opsanus, organ"
"Influence of Magnitude and Duration of Altered Gravity and Readaptation to 1g on the Structure and Function of the Utricle in Toadfish, Opsanus tau.",https://www.ncbi.nlm.nih.gov/pmc/articles/PMC6204554/,"duration, opsanus, gravity"
Organization of the ER-Golgi interface for membrane traffic control.,https://www.ncbi.nlm.nih.gov/pmc/articles/PMC4064004/,"membrane, control, traffic"
IRE1: ER stress sensor and cell fate executor.,https://www.ncbi.nlm.nih.gov/pmc/articles/PMC3818365/,"sensor, ire1, stress"
Inter-regulation of the unfolded protein response and auxin signaling.,https://www.ncbi.nlm.nih.gov/pmc/articles/PMC3981873/,"unfolded, signaling, protein"
Endoplasmic reticulum-shape and function in stress translation,https://www.ncbi.nlm.nih.gov/pmc/articles/PMC4150462/,"reticulum-shape, function, stress"
Galactose-depleted xycoglucan is dysfunctional and leads to dwarfism in Arabidopsis,https://www.ncbi.nlm.nih.gov/pmc/articles/PMC4378170/,"xycoglucan, arabidopsis, leads"
"Unfolded protein response in plants: one master, many questions.",https://www.ncbi.nlm.nih.gov/pmc/articles/PMC4618186/,"many, response, protein"
Vesicles versus Tubes: Is Endoplasmic Reticulum-Golgi Transport in Plants Fundamentally Different from Other Eukaryotes?,https://www.ncbi.nlm.nih.gov/pmc/articles/PMC4453782/,"plants, tubes, endoplasmic"
Pectin methylesterification impacts the relationship between photosynthesis and plant growth.,https://www.ncbi.nlm.nih.gov/pmc/articles/PMC4902601/,"between, relationship, methylesterification"
Reduced Chloroplast Coverage genes from Arabidopsis thaliana help to establish the size of the chloroplast compartment,https://www.ncbi.nlm.nih.gov/pmc/articles/PMC4776492/,"arabidopsis, reduced, help"
Maintaining the factory: The roles of the unfolded protein response in cellular homeostasis in plants.,https://www.ncbi.nlm.nih.gov/pmc/articles/PMC5415411/,"factory, protein, maintaining"
NADPH oxidase activity is required for ER stress survival in plants.,https://www.ncbi.nlm.nih.gov/pmc/articles/PMC6289879/,"plants, activity, oxidase"
Relevance of the Unfolded Protein Response to Spaceflight-Induced Transcriptional Reprogramming in Arabidopsis,https://www.ncbi.nlm.nih.gov/pmc/articles/PMC7987364/,"reprogramming, transcriptional, arabidopsis"
Reanalysis of the Mars500 experiment reveals common gut microbiome alterations in astronauts induced by long-duration confinement,https://www.ncbi.nlm.nih.gov/pmc/articles/PMC8099722/,"reanalysis, common, induced"
"High atomic weight, high-energy radiation (HZE) induces transcriptional responses shared with conventional stresses in addition to a core ""DSB"" response specific to clastogenic treatments",https://www.ncbi.nlm.nih.gov/pmc/articles/PMC5116466/,"addition, core, transcriptional"
Genomic stability in response to high versus low linear energy transfer radiation in Arabidopsis thaliana,https://www.ncbi.nlm.nih.gov/pmc/articles/PMC4033213/,"versus, radiation, linear"
Acceleration profiles and processing methods for parabolic flight.,https://www.ncbi.nlm.nih.gov/pmc/articles/PMC6081456/,"flight, methods, profiles"
Cytoskeleton structure and total methylation of mouse cardiac and lung tissue during space flight.,https://www.ncbi.nlm.nih.gov/pmc/articles/PMC5955502/,"lung, structure, cardiac"
Toward countering muscle and bone loss with spaceflight: GSK3 as a potential target,https://www.ncbi.nlm.nih.gov/pmc/articles/PMC10285634/,"gsk3, toward, muscle"
Spaceflight increases sarcoplasmic reticulum Ca2+ leak and this cannot be counteracted with BuOE treatment,https://www.ncbi.nlm.nih.gov/pmc/articles/PMC11271499/,"counteracted, increases, treatment"
Cardiovascular progenitor cells cultured aboard the International Space Station exhibit altered developmental and functional properties,https://www.ncbi.nlm.nih.gov/pmc/articles/PMC6062551/,"progenitor, space, exhibit"
Inter-agency perspective: Translating advances in biomarker discovery and medical countermeasures development between terrestrial and space radiation environments,https://www.ncbi.nlm.nih.gov/pmc/articles/PMC9832585/,"development, countermeasures, between"
Genomic and functional characterization of Enterococcus faecalis isolates recovered from the International Space Station and their potential for pathogenicity,https://www.ncbi.nlm.nih.gov/pmc/articles/PMC7829349/,"station, space, characterization"
Evaluation of in vitro macrophage differentiation during space flight.,https://www.ncbi.nlm.nih.gov/pmc/articles/PMC3570223/,"during, flight, macrophage"
Identification of critical host mitochondrion-associated genes during Ehrlichia chaffeensis infections,https://www.ncbi.nlm.nih.gov/pmc/articles/PMC3457586/,"infections, host, genes"
Ehrlichia chaffeensis replication sites in adult Drosophila melanogaster.,https://www.ncbi.nlm.nih.gov/pmc/articles/PMC3558598/,"ehrlichia, sites, chaffeensis"
Development and characterization of two porcine monocyte-derived macrophage cell lines.,https://www.ncbi.nlm.nih.gov/pmc/articles/PMC11046949/,"monocyte-derived, porcine, cell"
Understanding macrophage differentiation during space flight: The importance of ground-based experiments before space flight,https://www.ncbi.nlm.nih.gov/pmc/articles/PMC3890248/,"experiments, during, importance"
Bone marrow leptin signaling mediates obesity-associated adipose tissue inflammation in male mice.,https://www.ncbi.nlm.nih.gov/pmc/articles/PMC3868799/,"inflammation, mice, tissue"
Establishment and characterization of DB-1: a leptin receptor-deficient murine macrophage cell line,https://www.ncbi.nlm.nih.gov/pmc/articles/PMC4960141/,"db-1, macrophage, murine"
Validation of methods to assess the immunoglobulin gene repertoire in tissues obtained from mice on the International Space Station.,https://www.ncbi.nlm.nih.gov/pmc/articles/PMC5736159/,"international, repertoire, tissues"
Characterization of the naive murine antibody repertoire using unamplified high-throughput sequencing,https://www.ncbi.nlm.nih.gov/pmc/articles/PMC5761896/,"sequencing, repertoire, unamplified"
Effects of spaceflight on the immunoglobulin repertoire of unimmunized C57BL/6 mice,https://www.ncbi.nlm.nih.gov/pmc/articles/PMC5826609/,"repertoire, c57bl/6, unimmunized"
A comparison of unamplified and massively multiplexed PCR amplification for murine antibody repertoire sequencing.,https://www.ncbi.nlm.nih.gov/pmc/articles/PMC6366624/,"sequencing, unamplified, massively"
Effects of skeletal unloading on the antibody repertoire of tetanus toxoid and/or CpG treated C57BL/6J mice.,https://www.ncbi.nlm.nih.gov/pmc/articles/PMC11929063/,"mice, toxoid, tetanus"
Effects of skeletal unloading on the bone marrow antibody repertoire of tetanus toxoid and/or CpG treated C57BL/6J mice.,https://www.ncbi.nlm.nih.gov/pmc/articles/PMC11929063/,"c57bl/6j, and/or, tetanus"
An Analysis of the Effects of Spaceflight and Vaccination on Antibody Repertoire Diversity,https://www.ncbi.nlm.nih.gov/pmc/articles/PMC10996920/,"analysis, diversity, vaccination"
Effects of spaceflight aboard the International Space Station on mouse estrous cycle and ovarian gene expression,https://www.ncbi.nlm.nih.gov/pmc/articles/PMC7954810/,"effects, expression, gene"
Effect of spaceflight on Pseudomonas aeruginosa final cell density is modulated by nutrient and oxygen availability.,https://www.ncbi.nlm.nih.gov/pmc/articles/PMC4228280/,"spaceflight, final, density"
Spaceflight promotes biofilm formation by Pseudomonas aeruginosa.,https://www.ncbi.nlm.nih.gov/pmc/articles/PMC3639165/,"spaceflight, biofilm, pseudomonas"
GeneLab: Omics database for spaceflight experiments,https://www.ncbi.nlm.nih.gov/pmc/articles/PMC8044432/,"experiments, database, spaceflight"
NASA GeneLab: Interfaces for the exploration of space omics data,https://www.ncbi.nlm.nih.gov/pmc/articles/PMC7778922/,"omics, interfaces, space"
Comprehensive multi-omics analysis reveals mitochondrial stress as a central biological hub for spaceflight impact,https://www.ncbi.nlm.nih.gov/pmc/articles/PMC7870178/,"analysis, comprehensive, biological"
A New Era for Space Life Science: International Standards for Space Omics Processing,https://www.ncbi.nlm.nih.gov/pmc/articles/PMC7733874/,"space, processing, life"
Knowledge Network Embedding of Transcriptomic Data from Spaceflown Mice Uncovers Signs and Symptoms Associated with Terrestrial Diseases,https://www.ncbi.nlm.nih.gov/pmc/articles/PMC7828077/,"diseases, spaceflown, data"
NASA GeneLab RNA-Seq Consensus Pipeline: Standardized Processing of Short-Read RNA-Seq Data,https://www.ncbi.nlm.nih.gov/pmc/articles/PMC8044432/,"consensus, nasa, standardized"
Spatially resolved multiomics on the neuronal effects induced by spaceflight in mice,https://www.ncbi.nlm.nih.gov/pmc/articles/PMC11166911/,"effects, spaceflight, mice"
Biological horizons: pioneering open science in the cosmos,https://www.ncbi.nlm.nih.gov/pmc/articles/PMC11167097/,"pioneering, open, biological"
Inspiration4 data access through the NASA Open Science Data Repository,https://www.ncbi.nlm.nih.gov/pmc/articles/PMC11094041/,"data, access, inspiration4"
NASA GeneLab derived microarray studies of Mus musculus and Homo sapiens organisms in altered gravitational conditions.,https://www.ncbi.nlm.nih.gov/pmc/articles/PMC11053165/,"conditions, studies, nasa"
Celebrating 30 years of access to NASA space life sciences data,https://www.ncbi.nlm.nih.gov/pmc/articles/PMC11403809/,"years, nasa, celebrating"
Dichotomous effects on lymphatic transport with loss of caveolae in mice.,https://www.ncbi.nlm.nih.gov/pmc/articles/PMC8513672/,"loss, dichotomous, lymphatic"
Fungal diversity differences in the indoor dust microbiome from built environments on Earth and in space.,https://www.ncbi.nlm.nih.gov/pmc/articles/PMC11126634/,"earth, dust, diversity"
Predicting how varying moisture conditions impact the microbiome of dust collected from the International Space Station,https://www.ncbi.nlm.nih.gov/pmc/articles/PMC11386075/,"dust, international, microbiome"
Aging and estrogen status: A possible endothelium-dependent vascular coupling mechanism in bone remodeling.,https://www.ncbi.nlm.nih.gov/pmc/articles/PMC3502426/,"coupling, remodeling, aging"
Chronic skeletal unloading of the rat femur: mechanisms and functional consequences of vascular remodeling.,https://www.ncbi.nlm.nih.gov/pmc/articles/PMC3856860/,"chronic, mechanisms, remodeling"
Differential effects of aging and exercise on intra-abdominal adipose arteriolar function and blood flow regulation.,https://www.ncbi.nlm.nih.gov/pmc/articles/PMC3615599/,"aging, differential, effects"
Effects of spaceflight and ground recovery on mesenteric artery and vein constrictor properties in mice.,https://www.ncbi.nlm.nih.gov/pmc/articles/PMC4050424/,"ground, mesenteric, properties"
"Spaceflight-induced alterations in cerebral artery vasoconstrictor, mechanical, and structural properties: Implications for elevated cerebral perfusion and intracranial pressure",https://www.ncbi.nlm.nih.gov/pmc/articles/PMC3659353/,"cerebral, implications, structural"
Exercise training augments regional bone and marrow blood flow during exercise.,https://www.ncbi.nlm.nih.gov/pmc/articles/PMC4169763/,"blood, exercise, marrow"
Effects of Skeletal Unloading on the Vasomotor Properties of the Rat Femur Principal Nutrient Artery,https://www.ncbi.nlm.nih.gov/pmc/articles/PMC4398884/,"nutrient, properties, unloading"
Type 2 diabetes alters bone and marrow blood flow and vascular control mechanisms in the ZDF rat.,https://www.ncbi.nlm.nih.gov/pmc/articles/PMC4379453/,"blood, vascular, control"
Spaceflight on the Bion-M1 biosatellite alters cerebral artery vasomotor and mechanical properties in mice,https://www.ncbi.nlm.nih.gov/pmc/articles/PMC4385880/,"bion-m1, properties, mechanical"
Apollo Lunar Astronauts Show Higher Cardiovascular Disease Mortality: Possible Deep Space Radiation Effects on the Vascular Endothelium,https://www.ncbi.nlm.nih.gov/pmc/articles/PMC4964660/,"deep, higher, effects"
Effects of age and exercise training on coronary microvascular smooth muscle phenotype and function,https://www.ncbi.nlm.nih.gov/pmc/articles/PMC5866446/,"function, phenotype, coronary"
Impact of Spaceflight and Artificial Gravity on the Mouse Retina: Biochemical and Proteomic Analysis.,https://www.ncbi.nlm.nih.gov/pmc/articles/PMC6165321/,"proteomic, retina, artificial"
Simulated microgravity induces regionally distinct neurovascular and structural remodeling of skeletal muscle and cutaneous arteries in the rat,https://www.ncbi.nlm.nih.gov/pmc/articles/PMC7339929/,"distinct, structural, arteries"
Spaceflight decelerates the epigenetic clock orchestrated with a global alteration in DNA methylome and transcriptome in the mouse retina,https://www.ncbi.nlm.nih.gov/pmc/articles/PMC8220224/,"epigenetic, clock, transcriptome"
Development of otolith receptors in Japanese quail.,https://www.ncbi.nlm.nih.gov/pmc/articles/PMC2910419/,"japanese, otolith, development"
Spatial and temporal characteristics of vestibular convergence,https://www.ncbi.nlm.nih.gov/pmc/articles/PMC3166430/,"convergence, temporal, vestibular"
Bone remodeling is regulated by inner ear vestibular signals,https://www.ncbi.nlm.nih.gov/pmc/articles/PMC6615562/,"remodeling, inner, bone"
Simulated Microgravity Enhances Oligodendrocyte Mitochondrial Function and Lipid Metabolism,https://www.ncbi.nlm.nih.gov/pmc/articles/PMC7324008/,"microgravity, oligodendrocyte, simulated"
Human Neural Stem Cells Flown into Space Proliferate and Generate Young Neurons,https://www.ncbi.nlm.nih.gov/pmc/articles/PMC8412175/,"cells, generate, neural"
Delayed Maturation of Oligodendrocyte Progenitors by Microgravity: Implications for Multiple Sclerosis and Space Flight,https://www.ncbi.nlm.nih.gov/pmc/articles/PMC10607959/,"flight, sclerosis, maturation"
Space Microgravity Alters Neural Stem Cell Division: Implications for Brain Cancer Research on Earth and in Space,https://www.ncbi.nlm.nih.gov/pmc/articles/PMC9699585/,"microgravity, space, space"
