Title,Link,Keywords
Reduced Arogenate Dehydratase Expression: Ramifications for Photosynthesis and Metabolism,https://www.ncbi.nlm.nih.gov/pmc/articles/PMC5933128/,"expression, reduced, photosynthesis"
New insights into lignification via network and multi-omics analyses of arogenate dehydratase knock-out mutants in Arabidopsis thaliana,https://www.ncbi.nlm.nih.gov/pmc/articles/PMC8185232/,"lignification, knock-out, dehydratase"
Functional consequences of radiation-induced oxidative stress in cultured neural stem cells and the brain exposed to charged particle irradiation,https://www.ncbi.nlm.nih.gov/pmc/articles/PMC3936501/,"cultured, radiation-induced, particle"
Exploration of space to achieve scientific breakthroughs,https://www.ncbi.nlm.nih.gov/pmc/articles/PMC11998595/,"scientific, breakthroughs, exploration"
Network Analysis of Gene Transcriptions of Arabidopsis thaliana in Spaceflight Microgravity.,https://www.ncbi.nlm.nih.gov/pmc/articles/PMC7996555/,"network, transcriptions, gene"
Detection of Genes in Arabidopsis thaliana L. Responding to DNA Damage from Radiation and Other Stressors in Spaceflight,https://www.ncbi.nlm.nih.gov/pmc/articles/PMC8234954/,"detection, genes, radiation"
"The Effect of spaceflight on mouse olfactory bulb volume, neurogenesis, and cell death indicates the protective effect of novel environment.",https://www.ncbi.nlm.nih.gov/pmc/articles/PMC4152162/,"cell, olfactory, novel"
"Effects of low-dose rate γ-irradiation combined with simulated microgravity on markers of oxidative stress, DNA methylation potential, and remodeling in the mouse heart",https://www.ncbi.nlm.nih.gov/pmc/articles/PMC5498037/,"remodeling, combined, oxidative"
Characterization of mouse ocular response to a 35-day spaceflight mission: Evidence of blood-retinal barrier disruption and ocular adaptations.,https://www.ncbi.nlm.nih.gov/pmc/articles/PMC6547757/,"disruption, evidence, mission"
Mice Exposed to Combined Chronic Low-Dose Irradiation and Modeled Microgravity Develop Long-Term Neurological Sequelae.,https://www.ncbi.nlm.nih.gov/pmc/articles/PMC6747492/,"low-dose, long-term, irradiation"
"Spaceflight influences gene expression, photoreceptor integrity, and oxidative stress-related damage in the murine retina.",https://www.ncbi.nlm.nih.gov/pmc/articles/PMC6746706/,"gene, murine, damage"
Evaluating ocular response in the retina and optic nerve head after single and fractionated high-energy protons,https://www.ncbi.nlm.nih.gov/pmc/articles/PMC8400407/,"nerve, fractionated, response"
Characterization of gene expression profiles in the mouse brain after 35 days of spaceflight mission.,https://www.ncbi.nlm.nih.gov/pmc/articles/PMC9365836/,"spaceflight, profiles, characterization"
A multi-omics longitudinal study of the murine retinal response to chronic low-dose irradiation and simulated microgravity.,https://www.ncbi.nlm.nih.gov/pmc/articles/PMC9547011/,"response, simulated, murine"
Evidence of spaceflight-induced adverse effects on photoreceptors and retinal function in the mouse eye.,https://www.ncbi.nlm.nih.gov/pmc/articles/PMC10138634/,"photoreceptors, spaceflight-induced, function"
Effects of spaceflight on the brain,https://www.ncbi.nlm.nih.gov/pmc/articles/PMC12031868/,"spaceflight, effects, brain"
Routine omics collection is a golden opportunity for European human research in space and analog environments.,https://www.ncbi.nlm.nih.gov/pmc/articles/PMC9583032/,"opportunity, routine, human"
Spatial omics technologies at multimodal and single cell/subcellular level.,https://www.ncbi.nlm.nih.gov/pmc/articles/PMC9746133/,"omics, technologies, spatial"
Genomic characterization and radiation tolerance of Naganishia kalamii sp. nov. and Cystobasidium onofrii sp. nov. from Mars 2020 mission assembly facilities.,https://www.ncbi.nlm.nih.gov/pmc/articles/PMC10422843/,"nov, facilities, cystobasidium"
"Genome and clonal hematopoiesis stability contrasts with immune, cfDNA, mitochondrial, and telomere length changes during short duration spaceflight",https://www.ncbi.nlm.nih.gov/pmc/articles/PMC11022651/,"spaceflight, length, mitochondrial"
Inspiration4 data access through the NASA Open Science Data Repository,https://www.ncbi.nlm.nih.gov/pmc/articles/PMC11094041/,"nasa, inspiration4, data"
Molecular and physiologic changes in the SpaceX Inspiration4 civilian crew,https://www.ncbi.nlm.nih.gov/pmc/articles/PMC11357997/,"molecular, crew, civilian"
Telomeric RNA (TERRA) increases in response to spaceflight and high-altitude climbing,https://www.ncbi.nlm.nih.gov/pmc/articles/PMC11167063/,"(terra), high-altitude, increases"
Spatial multi-omics of human skin reveals KRAS and inflammatory responses to spaceflight,https://www.ncbi.nlm.nih.gov/pmc/articles/PMC11166909/,"responses, inflammatory, multi-omics"
Longitudinal multi-omics analysis of host microbiome architecture and immune responses during short-term spaceflight,https://www.ncbi.nlm.nih.gov/pmc/articles/PMC11222149/,"longitudinal, immune, architecture"
Spatiotemporal expression and control of haemoglobin in space,https://www.ncbi.nlm.nih.gov/pmc/articles/PMC11166948/,"haemoglobin, space, spatiotemporal"
"Single-cell multi-ome and immune profiles of the Inspiration4 crew reveal conserved, cell-type, and sex-specific responses to spaceflight",https://www.ncbi.nlm.nih.gov/pmc/articles/PMC11166952/,"single-cell, crew, sex-specific"
Single-cell analysis identifies conserved features of immune dysfunction in simulated microgravity and spaceflight,https://www.ncbi.nlm.nih.gov/pmc/articles/PMC11166937/,"conserved, simulated, features"
The Space Omics and Medical Atlas (SOMA) and international astronaut biobank,https://www.ncbi.nlm.nih.gov/pmc/articles/PMC11357981/,"(soma), international, medical"
"Secretome profiling reveals acute changes in oxidative stress, brain homeostasis, and coagulation following short-duration spaceflight",https://www.ncbi.nlm.nih.gov/pmc/articles/PMC11166969/,"short-duration, oxidative, spaceflight"
Astronaut omics and the impact of space on the human body at scale,https://www.ncbi.nlm.nih.gov/pmc/articles/PMC11166943/,"space, human, body"
Transcriptomics analysis reveals molecular alterations underpinning spaceflight dermatology.,https://www.ncbi.nlm.nih.gov/pmc/articles/PMC11166967/,"reveals, transcriptomics, dermatology"
"Cosmic kidney disease: an integrated pan-omic, physiological and morphological study into spaceflight-induced renal dysfunction",https://www.ncbi.nlm.nih.gov/pmc/articles/PMC11167060/,"integrated, physiological, cosmic"
Spaceflight induces changes in gene expression profiles linked to insulin and estrogen,https://www.ncbi.nlm.nih.gov/pmc/articles/PMC11166981/,"changes, induces, insulin"
Protective alleles and precision healthcare in crewed spaceflight,https://www.ncbi.nlm.nih.gov/pmc/articles/PMC11263583/,"healthcare, spaceflight, protective"
To boldly go where no microRNAs have gone before: Spaceflight impact on risk for small-for-gestational-age infants,https://www.ncbi.nlm.nih.gov/pmc/articles/PMC11484870/,"risk, impact, have"
Growth chambers on the International Space Station for large plants,https://www.ncbi.nlm.nih.gov/pmc/articles/PMC10780891/,"growth, station, space"
Microbiological and nutritional analysis of lettuce crops grown on the International Space Station,https://www.ncbi.nlm.nih.gov/pmc/articles/PMC7067979/,"crops, international, station"
Natural variation in the expression of ORGANIC CATION TRANSPORTER 1 affects root length responses to cadaverine in Arabidopsis.,https://www.ncbi.nlm.nih.gov/pmc/articles/PMC4321547/,"cadaverine, length, transporter"
Auxin: Shape matters.,https://www.ncbi.nlm.nih.gov/pmc/articles/PMC6710492/,"matters, auxin, shape"
Gravity signaling in flowering plant roots,https://www.ncbi.nlm.nih.gov/pmc/articles/PMC12008199/,"roots, plant, flowering"
Cadaverine regulates biotin synthesis to modulate primary root growth in Arabidopsis,https://www.ncbi.nlm.nih.gov/pmc/articles/PMC8518694/,"cadaverine, growth, arabidopsis"
Low-speed clinorotation of Brachypodium distachyon and Arabidopsis thaliana seedlings triggers root tip curvatures that are reminiscent of gravitropism.,https://www.ncbi.nlm.nih.gov/pmc/articles/PMC9861679/,"arabidopsis, seedlings, reminiscent"
New device for high-throughput viability screening of flow biofilms,https://www.ncbi.nlm.nih.gov/pmc/articles/PMC2897429/,"device, viability, flow"
Sigma S-dependent antioxidant defense protects stationary-phase Escherichia coli against the bactericidal antibiotic gentamicin,https://www.ncbi.nlm.nih.gov/pmc/articles/PMC4187989/,"sigma, escherichia, stationary-phase"
Plasma membrane disruption (PMD) formation and repair in mechanosensitive tissues,https://www.ncbi.nlm.nih.gov/pmc/articles/PMC8217198/,"mechanosensitive, formation, repair"
Microgravity alters the expression of salivary proteins,https://www.ncbi.nlm.nih.gov/pmc/articles/PMC6981245/,"microgravity, alters, salivary"
Salivary Gland Protein Expression after Bion-M1 and Space Shuttle STS-135 Missions,https://www.ncbi.nlm.nih.gov/pmc/articles/PMC6981245/,"bion-m1, protein, gland"
Response of the mouse sublingual gland to spaceflight.,https://www.ncbi.nlm.nih.gov/pmc/articles/PMC6131065/,"gland, response, mouse"
Effects of spaceflight on the mouse submandibular gland,https://www.ncbi.nlm.nih.gov/pmc/articles/PMC11233762/,"mouse, effects, gland"
"Reactivation of Latent Epstein-Barr Virus: A Comparison after Exposure to Gamma, Proton, Carbon, and Iron Radiation",https://www.ncbi.nlm.nih.gov/pmc/articles/PMC6213004/,"epstein-barr, proton, iron"
The influence of spaceflight on the astronaut salivary microbiome and the search for a microbiome biomarker for viral reactivation,https://www.ncbi.nlm.nih.gov/pmc/articles/PMC7171750/,"microbiome, search, reactivation"
The cyclic nucleotide-gated channel CNGC14 regulates root gravitropism in Arabidopsis thaliana.,https://www.ncbi.nlm.nih.gov/pmc/articles/PMC10414970/,"cyclic, regulates, gravitropism"
Telomere length assessments of muscle stem cells in rodent and human skeletal muscle sections,https://www.ncbi.nlm.nih.gov/pmc/articles/PMC8450295/,"cells, rodent, telomere"
Persistent NF-κB activation in muscle stem cells induces proliferation-independent telomere shortening,https://www.ncbi.nlm.nih.gov/pmc/articles/PMC8183356/,"muscle, stem, nf-Ϻb"
Piezo1 regulates the regenerative capacity of skeletal muscles via orchestration of stem cell morphological states.,https://www.ncbi.nlm.nih.gov/pmc/articles/PMC8932657/,"regenerative, orchestration, capacity"
"Impacts of radiation exposure, hindlimb unloading, and recovery on murine skeletal muscle cell telomere length.",https://www.ncbi.nlm.nih.gov/pmc/articles/PMC10504369/,"radiation, muscle, telomere"
Ethylene-induced flavonol accumulation in guard cells suppresses reactive oxygen species and modulates stomatal aperture,https://www.ncbi.nlm.nih.gov/pmc/articles/PMC3982735/,"oxygen, reactive, species"
Transcriptional and Hormonal Regulation of Gravitropism of Woody Stems in Populus.,https://www.ncbi.nlm.nih.gov/pmc/articles/PMC4682325/,"stems, woody, regulation"
Endosidin2 targets conserved exocyst complex subunit EXO70 to inhibit exocytosis,https://www.ncbi.nlm.nih.gov/pmc/articles/PMC10264680/,"conserved, targets, complex"
"A conditional mutation in SCD1 reveals linkage between PIN protein trafficking, auxin transport, gravitropism, and lateral root initiation.",https://www.ncbi.nlm.nih.gov/pmc/articles/PMC7358545/,"conditional, protein, gravitropism"
"A comprehensive SARS-CoV-2 and COVID-19 review, Part 1: Intracellular overdrive for SARS-CoV-2 infection.",https://www.ncbi.nlm.nih.gov/pmc/articles/PMC9108708/,"overdrive, part, sars-cov-2"
Changes in nuclear shape and gene expression in response to simulated microgravity are LINC complex-dependent.,https://www.ncbi.nlm.nih.gov/pmc/articles/PMC7555797/,"linc, shape, microgravity"
"Growth of Carnobacterium spp. from permafrost under low pressure, temperature, and anoxic atmosphere has implications for Earth microbes on Mars",https://www.ncbi.nlm.nih.gov/pmc/articles/PMC3545801/,"carnobacterium, earth, implications"
Complete Genome Sequence of Carnobacterium gilichinskyi Strain WN1359T (DSM 27470T),https://www.ncbi.nlm.nih.gov/pmc/articles/PMC3869332/,"(dsm, complete, genome"
"Exposure of Bacillus subtilis to low pressure (5 kilopascals) induces several global regulons, including those involved in the SigB-mediated general stress response",https://www.ncbi.nlm.nih.gov/pmc/articles/PMC4135744/,"exposure, response, global"
"Resistance of Bacillus subtilis Spore DNA to Lethal Ionizing Radiation Damage Relies Primarily on Spore Core Components and DNA Repair, with Minor Effects of Oxygen Radical Detoxification",https://www.ncbi.nlm.nih.gov/pmc/articles/PMC3911009/,"lethal, core, resistance"
Cultivation of Staphylococcus epidermidis in the human spaceflight environment leads to alterations in the frequency and spectrum of spontaneous rifampicin-resistance mutations in the rpoB gene,https://www.ncbi.nlm.nih.gov/pmc/articles/PMC4923109/,"cultivation, gene, frequency"
Experimental Evolution of Bacillus subtilis,https://www.ncbi.nlm.nih.gov/pmc/articles/PMC11673879/,"bacillus, evolution, experimental"
Cultivation in space flight produces minimal alterations in the susceptibility of Bacillus subtilis cells to 72 different antibiotics and growth-inhibiting compounds,https://www.ncbi.nlm.nih.gov/pmc/articles/PMC5648920/,"minimal, compounds, susceptibility"
Alterations in the Spectrum of Spontaneous Rifampicin-Resistance Mutations in the Bacillus subtilis rpoB Gene after Cultivation in the Human Spaceflight Environment,https://www.ncbi.nlm.nih.gov/pmc/articles/PMC5817088/,"spaceflight, rpob, rifampicin-resistance"
Mechanotransduction in Prokaryotes: A Possible Mechanism of Spaceflight Adaptation,https://www.ncbi.nlm.nih.gov/pmc/articles/PMC7825584/,"prokaryotes, mechanism, spaceflight"
Environmental dependence of competitive fitness in rifampin-resistant rpoB mutants of Bacillus subtilis.,https://www.ncbi.nlm.nih.gov/pmc/articles/PMC8904044/,"dependence, rifampin-resistant, environmental"
Analysis of interactions of Salmonella type three secretion mutants with 3-D intestinal epithelial cells.,https://www.ncbi.nlm.nih.gov/pmc/articles/PMC3012082/,"salmonella, intestinal, epithelial"
Organotypic 3D cell culture models: using the rotating wall vessel to study host-pathogen interactions.,https://www.ncbi.nlm.nih.gov/pmc/articles/PMC11088941/,"cell, host-pathogen, wall"
Induction of attachment-independent biofilm formation and repression of Hfq expression by low-fluid-shear culture of Staphylococcus aureus,https://www.ncbi.nlm.nih.gov/pmc/articles/PMC3187170/,"induction, staphylococcus, low-fluid-shear"
Characterization of the Salmonella enterica serovar Typhimurium ydcI gene which encodes a conserved DNA binding protein required for full acid stress resistance.,https://www.ncbi.nlm.nih.gov/pmc/articles/PMC3133089/,"conserved, full, protein"
Evaluation of microorganisms cultured from injured and repressed tissue regeneration sites in endangered giant aquatic Ozark Hellbender salamanders.,https://www.ncbi.nlm.nih.gov/pmc/articles/PMC3242767/,"salamanders, microorganisms, tissue"
Transcriptional and proteomic responses of Pseudomonas aeruginosa PAO1 to spaceflight conditions involve Hfq regulation and reveal a role for oxygen.,https://www.ncbi.nlm.nih.gov/pmc/articles/PMC3067220/,"pseudomonas, proteomic, reveal"
New insights into the bacterial fitness-associated mechanisms revealed by the characterization of large plasmids of an avian pathogenic E. coli,https://www.ncbi.nlm.nih.gov/pmc/articles/PMC3251573/,"revealed, large, pathogenic"
Lack of norovirus replication and histo-blood group antigen expression in 3-dimensional intestinal epithelial cells,https://www.ncbi.nlm.nih.gov/pmc/articles/PMC3647661/,"antigen, 3-dimensional, intestinal"
Conservation of the low-shear modeled microgravity response in Enterobacteriaceae and analysis of the trp genes in this response.,https://www.ncbi.nlm.nih.gov/pmc/articles/PMC4085587/,"modeled, response, conservation"
Mimicking the host and its microenvironment in vitro for studying mucosal infections by Pseudomonas aeruginosa.,https://www.ncbi.nlm.nih.gov/pmc/articles/PMC4096993/,"microenvironment, vitro, host"
Effects of Sex and Gender on Adaptation to Space: Immune System,https://www.ncbi.nlm.nih.gov/pmc/articles/PMC7467030/,"gender, immune, adaptation"
Recellularization of decellularized lung scaffolds is enhanced by dynamic suspension culture.,https://www.ncbi.nlm.nih.gov/pmc/articles/PMC4427280/,"suspension, lung, decellularized"
Three-dimensional organotypic co-culture model of intestinal epithelial cells and macrophages to study Salmonella enterica colonization patterns.,https://www.ncbi.nlm.nih.gov/pmc/articles/PMC5460263/,"model, organotypic, intestinal"
Modeling Host-Pathogen Interactions in the Context of the Microenvironment: 3-D Cell Culture Comes of Age.,https://www.ncbi.nlm.nih.gov/pmc/articles/PMC6204695/,"modeling, host-pathogen, interactions"
Evaluating the effect of spaceflight on the host–pathogen interaction between human intestinal epithelial cells and Salmonella Typhimurium,https://www.ncbi.nlm.nih.gov/pmc/articles/PMC7943786/,"effect, intestinal, spaceflight"
Rapid phenotypic response of LSMMG-'primed' Candida albicans.,https://www.ncbi.nlm.nih.gov/pmc/articles/PMC11888247/,"rapid, lsmmg-'primed', response"
Spaceflight enhances cell aggregation and random budding in Candida albicans.,https://www.ncbi.nlm.nih.gov/pmc/articles/PMC3851762/,"enhances, budding, random"
"Growth and antifungal resistance of the pathogenic yeast, Candida albicans, in the microgravity environment of the International Space Station: An aggregate of multiple flight experiences.",https://www.ncbi.nlm.nih.gov/pmc/articles/PMC8067245/,"resistance, candida, station"
NASA GeneLab RNA-Seq Consensus Pipeline: Standardized Processing of Short-Read RNA-Seq Data,https://www.ncbi.nlm.nih.gov/pmc/articles/PMC8044432/,"short-read, pipeline, genelab"
Challenges and considerations for single-cell and spatially resolved transcriptomics sample collection during spaceflight.,https://www.ncbi.nlm.nih.gov/pmc/articles/PMC9701605/,"during, spatially, resolved"
Direct RNA sequencing of astronaut blood reveals spaceflight-associated m6A increases and hematopoietic transcriptional responses,https://www.ncbi.nlm.nih.gov/pmc/articles/PMC11166648/,"hematopoietic, direct, increases"
Collection of biospecimens from the inspiration4 mission establishes the standards for the space omics and medical atlas (SOMA),https://www.ncbi.nlm.nih.gov/pmc/articles/PMC11166662/,"(soma), inspiration4, biospecimens"
Microfluidics-enabled method to identify modes of Caenorhabditis elegans paralysis in four anthelmintics.,https://www.ncbi.nlm.nih.gov/pmc/articles/PMC3838407/,"modes, anthelmintics, paralysis"
Multiparameter behavioral analyses provide insights to mechanisms of cyanide resistance in Caenorhabditis elegans.,https://www.ncbi.nlm.nih.gov/pmc/articles/PMC3748764/,"elegans, insights, cyanide"
Growth performance and root transcriptome remodeling of Arabidopsis in response to Mars-like levels of magnesium sulfate.,https://www.ncbi.nlm.nih.gov/pmc/articles/PMC2925951/,"levels, magnesium, mars-like"
The 14-3-3 proteins of Arabidopsis regulate root growth and chloroplast development as components of the photosensory system.,https://www.ncbi.nlm.nih.gov/pmc/articles/PMC3350920/,"system, development, arabidopsis"
14-3-3 phosphoprotein interaction networks - does isoform diversity present functional interaction specification?,https://www.ncbi.nlm.nih.gov/pmc/articles/PMC3422896/,"networks, diversity, interaction"
Plant growth strategies are remodeled by spaceflight,https://www.ncbi.nlm.nih.gov/pmc/articles/PMC11869762/,"plant, growth, spaceflight"
Spaceflight transcriptomes: unique responses to a novel environment.,https://www.ncbi.nlm.nih.gov/pmc/articles/PMC10712242/,"spaceflight, environment, transcriptomes"
Fundamental plant biology enabled by the space shuttle.,https://www.ncbi.nlm.nih.gov/pmc/articles/PMC6143729/,"enabled, shuttle, plant"
Organ-specific remodeling of the Arabidopsis transcriptome in response to spaceflight.,https://www.ncbi.nlm.nih.gov/pmc/articles/PMC10058394/,"remodeling, transcriptome, spaceflight"
A method for preparing spaceflight RNAlater-fixed Arabidopsis thaliana (Brassicaceae) tissue for scanning electron microscopy.,https://www.ncbi.nlm.nih.gov/pmc/articles/PMC4103452/,"electron, tissue, arabidopsis"
ARG1 Functions in the Physiological Adaptation of Undifferentiated Plant Cells to Spaceflight,https://www.ncbi.nlm.nih.gov/pmc/articles/PMC8024390/,"adaptation, cells, arg1"
A Member of the CONSTANS-Like Protein Family is a Putative Regulator of ROS Homeostasis and Spaceflight Physiological Adaptation,https://www.ncbi.nlm.nih.gov/pmc/articles/PMC6348315/,"spaceflight, physiological, adaptation"
HSFA2 Functions in the Physiological Adaptation of Undifferentiated Plant Cells to Spaceflight.,https://www.ncbi.nlm.nih.gov/pmc/articles/PMC6359015/,"undifferentiated, spaceflight, cells"
Neutrophil to Lymphocyte ratio: A biomarker to monitor the immune status of astronauts.,https://www.ncbi.nlm.nih.gov/pmc/articles/PMC7667275/,"neutrophil, lymphocyte, ratio"
Beyond low-Earth orbit: Characterizing immune and microRNA differentials following simulated deep spaceflight conditions in mice.,https://www.ncbi.nlm.nih.gov/pmc/articles/PMC7756144/,"microrna, mice, orbit"
Immunological and hematological outcomes following protracted low dose/low dose rate ionizing radiation and simulated microgravity,https://www.ncbi.nlm.nih.gov/pmc/articles/PMC8169688/,"dose/low, simulated, radiation"
Epigenomic regulators elongator complex subunit 2 and methyltransferase 1 differentially condition the spaceflight response in Arabidopsis,https://www.ncbi.nlm.nih.gov/pmc/articles/PMC8475764/,"condition, epigenomic, elongator"
Plants grown in Apollo lunar regolith present stress-associated transcriptomes that inform prospects for lunar exploration,https://www.ncbi.nlm.nih.gov/pmc/articles/PMC9098553/,"regolith, lunar, present"
Artificial gravity partially protects space-induced neurological deficits in Drosophila melanogaster.,https://www.ncbi.nlm.nih.gov/pmc/articles/PMC10503492/,"artificial, partially, space-induced"
Utilizing the KSC fixation tube to conduct human-tended plant biology experiments on a suborbital spaceflight,https://www.ncbi.nlm.nih.gov/pmc/articles/PMC9693084/,"experiments, biology, suborbital"
Changes in Mouse Thymus and Spleen after Return from the STS-135 Mission in Space,https://www.ncbi.nlm.nih.gov/pmc/articles/PMC3792163/,"spleen, thymus, mouse"
Post-Spaceflight (STS-135) Mouse Splenocytes Demonstrate Altered Activation Properties and Surface Molecule Expression.,https://www.ncbi.nlm.nih.gov/pmc/articles/PMC4430214/,"splenocytes, activation, molecule"
Changes in the distribution and function of leukocytes after whole-body iron ion irradiation.,https://www.ncbi.nlm.nih.gov/pmc/articles/PMC5045078/,"distribution, function, whole-body"
Is spaceflight-induced immune dysfunction linked to systemic changes in metabolism?,https://www.ncbi.nlm.nih.gov/pmc/articles/PMC5443495/,"spaceflight-induced, changes, immune"
Spaceflight Activates Autophagy Programs and the Proteasome in Mouse Liver,https://www.ncbi.nlm.nih.gov/pmc/articles/PMC5666744/,"spaceflight, activates, mouse"
Vive la radiorésistance!: Converging research in radiobiology and biogerontology to enhance human radioresistance for deep space exploration and colonization.,https://www.ncbi.nlm.nih.gov/pmc/articles/PMC5865701/,"radiobiology, research, vive"
Proteomic analysis of mouse brain subjected to spaceflight.,https://www.ncbi.nlm.nih.gov/pmc/articles/PMC6337482/,"spaceflight, subjected, proteomic"
Transcriptomic effects on the mouse heart following 30 days on the International Space Station.,https://www.ncbi.nlm.nih.gov/pmc/articles/PMC9953463/,"international, transcriptomic, effects"
Spaceflight-induced gene expression profiles in the mouse brain are attenuated by treatment with the antioxidant BuOE,https://www.ncbi.nlm.nih.gov/pmc/articles/PMC10487739/,"antioxidant, attenuated, treatment"
Basal signaling regulates plant growth and development,https://www.ncbi.nlm.nih.gov/pmc/articles/PMC11942576/,"basal, growth, plant"
Phosphoinositide-signaling is one component of a robust plant defense response,https://www.ncbi.nlm.nih.gov/pmc/articles/PMC4052902/,"robust, component, plant"
Uncovering transcriptional responses to fractional gravity in Arabidopsis roots,https://www.ncbi.nlm.nih.gov/pmc/articles/PMC8539686/,"uncovering, transcriptional, gravity"
Conserved plant transcriptional responses to microgravity from two consecutive spaceflight experiments.,https://www.ncbi.nlm.nih.gov/pmc/articles/PMC10800490/,"transcriptional, microgravity, plant"
RNAseq analysis of rodent spaceflight experiments is confounded by sample collection techniques,https://www.ncbi.nlm.nih.gov/pmc/articles/PMC7756143/,"experiments, techniques, collection"
Functional changes in the snail statocyst system elicited by microgravity,https://www.ncbi.nlm.nih.gov/pmc/articles/PMC3066201/,"functional, statocyst, changes"
Simulated microgravity impairs human NK [natural killer] cell cytotoxic activity against space radiation-relevant leukemic cells,https://www.ncbi.nlm.nih.gov/pmc/articles/PMC11324864/,"impairs, killer], space"
Multi-analyte biochip (MAB) based on all-solid-state ion-selective electrodes (ASSISE) for physiological research,https://www.ncbi.nlm.nih.gov/pmc/articles/PMC3665236/,"electrodes, research, physiological"
Lab-on-a-chip approaches for space-biology research.,https://www.ncbi.nlm.nih.gov/pmc/articles/PMC10470837/,"approaches, lab-on-a-chip, space-biology"
Plant chemical genomics: gravity sensing and response.,https://www.ncbi.nlm.nih.gov/pmc/articles/PMC10386755/,"sensing, plant, response"
