Title,Link,Keywords
The interaction of vortical flows with red cells in venous valve mimics.,https://www.ncbi.nlm.nih.gov/pmc/articles/PMC8896891/,"cells, vortical, interaction"
Mammalian and Invertebrate Models as Complementary Tools for Gaining Mechanistic Insight on Muscle Responses to Spaceflight,https://www.ncbi.nlm.nih.gov/pmc/articles/PMC8430797/,"complementary, insight, mammalian"
Investigation of simulated microgravity effects on Streptococcus mutans physiology and global gene expression.,https://www.ncbi.nlm.nih.gov/pmc/articles/PMC5460135/,"microgravity, investigation, mutans"
Altered quorum sensing and physiology of Staphylococcus aureus during spaceflight detected by multi-omics data analysis,https://www.ncbi.nlm.nih.gov/pmc/articles/PMC10774393/,"physiology, altered, aureus"
Homotypic vacuole fusion requires VTI11 and is regulated by phosphoinositides,https://www.ncbi.nlm.nih.gov/pmc/articles/PMC6126739/,"phosphoinositides, homotypic, vacuole"
REGULATOR OF BULB BIOGENESIS1 (RBB1) Is Involved in Vacuole Bulb Formation in Arabidopsis.,https://www.ncbi.nlm.nih.gov/pmc/articles/PMC4411111/,"involved, biogenesis1, bulb"
"Phosphoinositides control the localization of HOPS subunit VPS41, which together with VPS33 mediates vacuole fusion in plants.",https://www.ncbi.nlm.nih.gov/pmc/articles/PMC6126739/,"mediates, together, localization"
Microgravity enhances the phenotype of Arabidopsis zigzag-1 and reduces the Wortmannin-induced vacuole fusion in root cells.,https://www.ncbi.nlm.nih.gov/pmc/articles/PMC9445043/,"vacuole, root, arabidopsis"
Hypergravity disruption of homeorhetic adaptations to lactation in rat dams include changes in circadian clocks,https://www.ncbi.nlm.nih.gov/pmc/articles/PMC3509447/,"include, clocks, lactation"
Intrauterine exposure to maternal stress alters Bdnf IV DNA methylation and telomere length in the brain of adult rat offspring.,https://www.ncbi.nlm.nih.gov/pmc/articles/PMC5600826/,"adult, methylation, intrauterine"
Influence of gonadectomy on muscle health in micro- and partial-gravity environments in rats.,https://www.ncbi.nlm.nih.gov/pmc/articles/PMC10831389/,"gonadectomy, micro-, muscle"
Sex differences in muscle health in simulated micro- and partial-gravity environments in rats.,https://www.ncbi.nlm.nih.gov/pmc/articles/PMC10831389/,"differences, muscle, environments"
Brassinazole resistant 1 (BZR1)-dependent brassinosteroid signalling pathway leads to ectopic activation of quiescent cell division and suppresses columella stem cell differentiation,https://www.ncbi.nlm.nih.gov/pmc/articles/PMC4507784/,"(bzr1)-dependent, brassinosteroid, pathway"
Proteomic study of microsomal proteins reveals a key role for Arabidopsis Annexin 1 in mediating heat stress-induced increase in intracellular calcium levels.,https://www.ncbi.nlm.nih.gov/pmc/articles/PMC4349987/,"arabidopsis, stress-induced, study"
Apyrase inhibitors enhance the ability of diverse fungicides to inhibit the growth of different plant-pathogenic fungi,https://www.ncbi.nlm.nih.gov/pmc/articles/PMC6638264/,"diverse, growth, different"
ANN1 and ANN2 Function in Post-Phloem Sugar Transport in Root Tips to Affect Primary Root Growth,https://www.ncbi.nlm.nih.gov/pmc/articles/PMC6130020/,"post-phloem, affect, sugar"
Mitochondria-targeted human catalase in the mouse longevity MCAT model mitigates head-tilt bedrest-induced neuro-inflammation in the hippocampus.,https://www.ncbi.nlm.nih.gov/pmc/articles/PMC9695374/,"model, mitigates, longevity"
Structural and functional properties of bone are compromised in amyotrophic lateral sclerosis mice.,https://www.ncbi.nlm.nih.gov/pmc/articles/PMC6141014/,"mice, sclerosis, amyotrophic"
Longitudinal time course of muscle impairments during partial weight-bearing in rats,https://www.ncbi.nlm.nih.gov/pmc/articles/PMC6706399/,"partial, weight-bearing, rats"
The partial weight-bearing rat model using a pelvic harness does not impact stress or hindlimb blood flow.,https://www.ncbi.nlm.nih.gov/pmc/articles/PMC12034070/,"harness, blood, weight-bearing"
Dose-dependent skeletal deficits due to varied reductions in mechanical loading in rats.,https://www.ncbi.nlm.nih.gov/pmc/articles/PMC7235020/,"loading, skeletal, rats"
Approaching Gravity as a Continuum Using the Rat Partial Weight-Bearing Model,https://www.ncbi.nlm.nih.gov/pmc/articles/PMC7599661/,"partial, gravity, weight-bearing"
Hindlimb suspension in Wistar rats: Sex-based differences in muscle response,https://www.ncbi.nlm.nih.gov/pmc/articles/PMC8493566/,"rats, suspension, hindlimb"
Adaptation to full weight-bearing following disuse in rats: The impact of biological sex on musculoskeletal recovery,https://www.ncbi.nlm.nih.gov/pmc/articles/PMC10926278/,"impact, rats, recovery"
Effects of liquid cultivation on gene expression and phenotype of C. elegans.,https://www.ncbi.nlm.nih.gov/pmc/articles/PMC6069985/,"phenotype, cultivation, gene"
Transcriptomic Signature of the Simulated Microgravity Response in Caenorhabditis elegans and Comparison to Spaceflight Experiments.,https://www.ncbi.nlm.nih.gov/pmc/articles/PMC9856674/,"experiments, caenorhabditis, simulated"
Enabling clonal analyses of yeast in outer space by encapsulation and desiccation in hollow microparticles.,https://www.ncbi.nlm.nih.gov/pmc/articles/PMC9410522/,"yeast, enabling, desiccation"
Caenorhabditis elegans in microgravity: An omics perspective,https://www.ncbi.nlm.nih.gov/pmc/articles/PMC10344948/,"perspective, elegans, microgravity"
Dried plum diet protects from bone loss caused by ionizing radiation,https://www.ncbi.nlm.nih.gov/pmc/articles/PMC4750446/,"protects, radiation, ionizing"
Dietary countermeasure mitigates simulated spaceflight-induced osteopenia in mice,https://www.ncbi.nlm.nih.gov/pmc/articles/PMC7162976/,"dietary, spaceflight-induced, mice"
Simulated microgravity alters gene regulation linked to immunity and cardiovascular disease,https://www.ncbi.nlm.nih.gov/pmc/articles/PMC11353732/,"simulated, microgravity, gene"
Autophagy and its consequences for platelet biology,https://www.ncbi.nlm.nih.gov/pmc/articles/PMC11953390/,"platelet, biology, autophagy"
A new role of NAP1L1 in megakaryocytes and human platelets,https://www.ncbi.nlm.nih.gov/pmc/articles/PMC9737020/,"role, megakaryocytes, nap1l1"
Evaluation of rodent spaceflight in the NASA animal enclosure module for an extended operational period (up to 35 days),https://www.ncbi.nlm.nih.gov/pmc/articles/PMC5515519/,"period, extended, rodent"
Morphology of Penicillium rubens Biofilms Formed in Space,https://www.ncbi.nlm.nih.gov/pmc/articles/PMC10144393/,"penicillium, rubens, morphology"
Explainable machine learning identifies multi-omics signatures of muscle response to spaceflight in mice,https://www.ncbi.nlm.nih.gov/pmc/articles/PMC10719374/,"multi-omics, spaceflight, mice"
Microbial adaptation to spaceflight is correlated with bacteriophage-encoded functions,https://www.ncbi.nlm.nih.gov/pmc/articles/PMC11096397/,"microbial, adaptation, correlated"
Influence of the spaceflight environment on macrophage lineages,https://www.ncbi.nlm.nih.gov/pmc/articles/PMC11166655/,"environment, spaceflight, lineages"
MARSBOx: Fungal and bacterial endurance from a balloon-flown analog mission in the stratosphere,https://www.ncbi.nlm.nih.gov/pmc/articles/PMC7937622/,"marsbox, balloon-flown, mission"
In situ linkage of fungal and bacterial proliferation to microbiologically influenced corrosion in B20 biodiesel storage tanks.,https://www.ncbi.nlm.nih.gov/pmc/articles/PMC7055474/,"influenced, tanks, proliferation"
"Identification of metagenome-assembled genomes containing antimicrobial resistance genes, isolated from an advanced water treatment facility.",https://www.ncbi.nlm.nih.gov/pmc/articles/PMC7118179/,"water, isolated, genes"
Nature of pre-earthquake phenomena and their effects on living organisms,https://www.ncbi.nlm.nih.gov/pmc/articles/PMC4494396/,"nature, their, effects"
The rapid diagnosis and effective inhibition of coronavirus using spike antibody attached gold nanoparticles,https://www.ncbi.nlm.nih.gov/pmc/articles/PMC8323809/,"rapid, nanoparticles, diagnosis"
Blocking SARS-CoV-2 Delta variant (B.1.617.2) spike protein receptor-binding domain binding with the ACE2 receptor of the host cell and inhibiting virus infections using human host defense peptide-conjugated graphene quantum dots.,https://www.ncbi.nlm.nih.gov/pmc/articles/PMC8886715/,"defense, sars-cov-2, peptide-conjugated"
Safety and pharmacokinetics of intranasally administered heparin,https://www.ncbi.nlm.nih.gov/pmc/articles/PMC8890767/,"intranasally, heparin, safety"
Inhibition of SARS-CoV-2 wild-type (Wuhan-Hu-1) and Delta (B.1.617.2) strains by marine sulfated glycans.,https://www.ncbi.nlm.nih.gov/pmc/articles/PMC9487896/,"wild-type, (b.1.617.2), delta"
Inhibition of Cytomegalovirus by Pentacta pygmaea Fucosylated Chondroitin Sulfate Depends on Its Molecular Weight,https://www.ncbi.nlm.nih.gov/pmc/articles/PMC10142442/,"depends, pentacta, sulfate"
Effect of simulated cosmic radiation on cytomegalovirus reactivation and lytic replication,https://www.ncbi.nlm.nih.gov/pmc/articles/PMC11477029/,"simulated, cytomegalovirus, cosmic"
A Tissue Retrieval and Postharvest Processing Regimen for Rodent Reproductive Tissues Compatible with Long-Term Storage on the International Space Station and Postflight Biospecimen Sharing Program,https://www.ncbi.nlm.nih.gov/pmc/articles/PMC4309301/,"tissues, storage, program"
Effects of sex and gender on adaptations to space: reproductive health,https://www.ncbi.nlm.nih.gov/pmc/articles/PMC11166981/,"adaptations, health, reproductive"
Effects of spaceflight on the muscles of the murine shoulder.,https://www.ncbi.nlm.nih.gov/pmc/articles/PMC6343501/,"spaceflight, muscles, murine"
Multiscale effects of spaceflight on murine tendon and bone,https://www.ncbi.nlm.nih.gov/pmc/articles/PMC7138367/,"tendon, multiscale, murine"
Reproducible changes in the gut microbiome suggest a shift in microbial and host metabolism during spaceflight.,https://www.ncbi.nlm.nih.gov/pmc/articles/PMC6689164/,"spaceflight, during, metabolism"
Failure to Generate Bone Marrow Adipocytes Does Not Protect Mice from Ovariectomy-Induced Osteopenia,https://www.ncbi.nlm.nih.gov/pmc/articles/PMC3564669/,"osteopenia, does, generate"
Acute exposure to high dose gamma-radiation results in transient activation of bone lining cells,https://www.ncbi.nlm.nih.gov/pmc/articles/PMC4042434/,"cells, gamma-radiation, activation"
Morbid obesity attenuates the skeletal abnormalities associated with leptin deficiency in mice,https://www.ncbi.nlm.nih.gov/pmc/articles/PMC4161659/,"abnormalities, associated, mice"
Hypothalamic leptin gene therapy reduces body weight without accelerating age-related bone loss,https://www.ncbi.nlm.nih.gov/pmc/articles/PMC4917201/,"reduces, without, age-related"
Hypothalamic Leptin Gene Therapy Reduces Bone Marrow Adiposity in ob/ob Mice Fed Regular and High-Fat Diets.,https://www.ncbi.nlm.nih.gov/pmc/articles/PMC4985531/,"diets, bone, adiposity"
Room temperature housing results in premature cancellous bone loss in growing female mice: implications for the mouse as a preclinical model for age-related bone loss.,https://www.ncbi.nlm.nih.gov/pmc/articles/PMC5421618/,"room, mouse, age-related"
Spaceflight-induced vertebral bone loss in ovariectomized rats is associated with increased bone marrow adiposity and no change in bone formation,https://www.ncbi.nlm.nih.gov/pmc/articles/PMC5515514/,"loss, ovariectomized, rats"
Role of oestrogen receptor signaling in skeletal response to leptin in female ob/ob mice.,https://www.ncbi.nlm.nih.gov/pmc/articles/PMC8671758/,"receptor, oestrogen, female"
Effects of hypothalamic leptin gene therapy on osteopetrosis in leptin-deficient mice.,https://www.ncbi.nlm.nih.gov/pmc/articles/PMC5771473/,"therapy, effects, mice"
Leptin stimulates bone formation in ob/ob mice at doses having minimal impact on energy metabolism.,https://www.ncbi.nlm.nih.gov/pmc/articles/PMC5288125/,"leptin, metabolism, ob/ob"
Bone Marrow Adipose Tissue Deficiency Increases Disuse-Induced Bone Loss in Male Mice,https://www.ncbi.nlm.nih.gov/pmc/articles/PMC5389344/,"adipose, bone, disuse-induced"
Metabolic Coupling Between Bone Marrow Adipose Tissue and Hematopoiesis,https://www.ncbi.nlm.nih.gov/pmc/articles/PMC9784906/,"metabolic, bone, adipose"
Maintenance of near normal bone mass and architecture in lethally irradiated female mice following adoptive transfer with as few as 750 purified hematopoietic stem cells.,https://www.ncbi.nlm.nih.gov/pmc/articles/PMC6548323/,"hematopoietic, female, transfer"
Effect of leptin deficiency on the skeletal response to hindlimb unloading in adult male mice.,https://www.ncbi.nlm.nih.gov/pmc/articles/PMC6597714/,"unloading, skeletal, adult"
Thermoneutral housing attenuates premature cancellous bone loss in male C57BL/6J mice,https://www.ncbi.nlm.nih.gov/pmc/articles/PMC6865368/,"bone, loss, premature"
Effects of Spaceflight on Cancellous and Cortical Bone in Proximal Femur in Growing Rats,https://www.ncbi.nlm.nih.gov/pmc/articles/PMC7907224/,"cortical, effects, rats"
Evidence for increased thermogenesis in female C57BL/6J mice housed aboard the international space station,https://www.ncbi.nlm.nih.gov/pmc/articles/PMC8213760/,"mice, space, increased"
Leptin and environmental temperature as determinants of bone marrow adiposity in female mice,https://www.ncbi.nlm.nih.gov/pmc/articles/PMC9582271/,"adiposity, female, environmental"
Small changes in thermoregulation influence cancellous bone turnover balance in distal femur metaphysis in growing female mice,https://www.ncbi.nlm.nih.gov/pmc/articles/PMC10063413/,"changes, thermoregulation, growing"
Bone Marrow Adipose Tissue Is Not Required for Reconstitution of the Immune System Following Irradiation in Male Mice,https://www.ncbi.nlm.nih.gov/pmc/articles/PMC10889206/,"marrow, tissue, following"
Simulated Microgravity Promotes Horizontal Gene Transfer of Antimicrobial Resistance Genes between Bacterial Genera in the Absence of Antibiotic Selective Pressure,https://www.ncbi.nlm.nih.gov/pmc/articles/PMC8468678/,"between, selective, horizontal"
Understanding the Complexities and Changes of the Astronaut Microbiome for Successful Long-Duration Space Missions,https://www.ncbi.nlm.nih.gov/pmc/articles/PMC9031868/,"space, long-duration, microbiome"
Toward sustainable space exploration: a roadmap for harnessing the power of microorganisms.,https://www.ncbi.nlm.nih.gov/pmc/articles/PMC10030976/,"harnessing, power, sustainable"
Roll maneuvers are essential for active reorientation of Caenorhabditis elegans in 3D media,https://www.ncbi.nlm.nih.gov/pmc/articles/PMC5910807/,"active, maneuvers, caenorhabditis"
Microfluidic Device for Studying Nematodes,https://www.ncbi.nlm.nih.gov/pmc/articles/PMC12021249/,"studying, nematodes, device"
NemaFlex: A microfluidics-based technology for standardized measurement of muscular strength of C. elegans.,https://www.ncbi.nlm.nih.gov/pmc/articles/PMC6057834/,"muscular, technology, elegans"
"Swim exercise in Caenorhabditis elegans extends neuromuscular and gut healthspan, enhances learning ability, and protects against neurodegeneration",https://www.ncbi.nlm.nih.gov/pmc/articles/PMC6876156/,"neurodegeneration, ability, elegans"
Molecular muscle experiment: Hardware and operational lessons for future astrobiology space experiments,https://www.ncbi.nlm.nih.gov/pmc/articles/PMC7415877/,"lessons, future, astrobiology"
Tart Cherry Increases Lifespan in Caenorhabditis elegans by Altering Metabolic Signaling Pathways,https://www.ncbi.nlm.nih.gov/pmc/articles/PMC7285199/,"cherry, pathways, signaling"
A region of UNC-89 (obscurin) lying between two protein kinase domains is a highly elastic spring required for proper sarcomere organization,https://www.ncbi.nlm.nih.gov/pmc/articles/PMC9549344/,"elastic, protein, region"
NemaLife chip: a micropillar-based microfluidic culture device optimized for aging studies in crawling C. elegans,https://www.ncbi.nlm.nih.gov/pmc/articles/PMC7530743/,"crawling, microfluidic, studies"
Spaceflight affects neuronal morphology and alters transcellular degradation of neuronal debris in adult Caenorhabditis elegans,https://www.ncbi.nlm.nih.gov/pmc/articles/PMC7890410/,"transcellular, degradation, elegans"
Microfluidics-integrated spaceflight hardware for measuring muscle strength of Caenorhabditis elegans on the International Space Station.,https://www.ncbi.nlm.nih.gov/pmc/articles/PMC9640571/,"spaceflight, international, caenorhabditis"
A Compact Imaging Platform for Conducting C. elegans Phenotypic Assays on Earth and in Spaceflight.,https://www.ncbi.nlm.nih.gov/pmc/articles/PMC9862956/,"imaging, earth, elegans"
Mitochondrial sulfide promotes life span and health span through distinct mechanisms in developing versus adult treated Caenorhabditis elegans.,https://www.ncbi.nlm.nih.gov/pmc/articles/PMC10410709/,"distinct, versus, through"
Bisphosphonates attenuate age-related muscle decline in Caenorhabditis elegans.,https://www.ncbi.nlm.nih.gov/pmc/articles/PMC10751425/,"bisphosphonates, muscle, caenorhabditis"
Spaceflight Induces Strength Decline in Caenorhabditis elegans,https://www.ncbi.nlm.nih.gov/pmc/articles/PMC10605753/,"decline, induces, caenorhabditis"
Metabolic model predictions enable targeted microbiome manipulation through precision prebiotics.,https://www.ncbi.nlm.nih.gov/pmc/articles/PMC10846184/,"microbiome, targeted, precision"
Transcriptomics analysis reveals molecular alterations underpinning spaceflight dermatology.,https://www.ncbi.nlm.nih.gov/pmc/articles/PMC11166967/,"transcriptomics, spaceflight, dermatology"
Identification and characterization of a skin microbiome on Caenorhabditis elegans suggests environmental microbes confer cuticle protection,https://www.ncbi.nlm.nih.gov/pmc/articles/PMC11302229/,"characterization, suggests, skin"
Protein kinase 2 of the giant sarcomeric protein UNC-89 regulates mitochondrial morphology and function,https://www.ncbi.nlm.nih.gov/pmc/articles/PMC11487192/,"regulates, protein, mitochondrial"
New perspectives on viable microbial communities in low-biomass cleanroom environments,https://www.ncbi.nlm.nih.gov/pmc/articles/PMC3554398/,"viable, cleanroom, environments"
Microbial existence in controlled habitats and their resistance to space conditions,https://www.ncbi.nlm.nih.gov/pmc/articles/PMC10370681/,"microbial, their, space"
Microbiomes of the dust particles collected from the International Space Station and Spacecraft assembly facilities,https://www.ncbi.nlm.nih.gov/pmc/articles/PMC4624184/,"station, international, microbiomes"
"Draft genome sequences of two Aspergillus fumigatus strains, isolated from the International Space Station",https://www.ncbi.nlm.nih.gov/pmc/articles/PMC4945788/,"fumigatus, strains, draft"
Characterization of Aspergillus fumigatus isolates from air and surfaces of the International Space Station.,https://www.ncbi.nlm.nih.gov/pmc/articles/PMC9116463/,"fumigatus, station, isolates"
Draft genome sequences of biosafety level 2 opportunistic pathogens isolated from the environmental surfaces of the International Space Station.,https://www.ncbi.nlm.nih.gov/pmc/articles/PMC5201052/,"environmental, space, surfaces"
Draft Genome Sequences of Several Fungal Strains Selected for Exposure to Microgravity at the International Space Station.,https://www.ncbi.nlm.nih.gov/pmc/articles/PMC5391430/,"several, selected, station"
Human presence impacts fungal diversity of inflated lunar/Mars analog habitat.,https://www.ncbi.nlm.nih.gov/pmc/articles/PMC5504618/,"inflated, diversity, habitat"
Whole metagenome profiles of particulates collected from the International Space Station,https://www.ncbi.nlm.nih.gov/pmc/articles/PMC5580210/,"whole, international, particulates"
Microbial Characteristics of ISS Environmental Surfaces,https://www.ncbi.nlm.nih.gov/pmc/articles/PMC8421509/,"characteristics, microbial, environmental"
"Draft Genome Sequences from a Novel Clade of Bacillus cereus Sensu Lato Strains, Isolated from the International Space Station.",https://www.ncbi.nlm.nih.gov/pmc/articles/PMC5552977/,"genome, strains, novel"
Draft Genome Sequences of Acinetobacter and Bacillus Strains Isolated from Spacecraft-Associated Surfaces,https://www.ncbi.nlm.nih.gov/pmc/articles/PMC5805884/,"spacecraft-associated, strains, acinetobacter"
KatharoSeq enables high-throughput microbiome analysis from low-biomass samples,https://www.ncbi.nlm.nih.gov/pmc/articles/PMC5864415/,"katharoseq, samples, analysis"
Draft genome sequence of a clinical isolate of Fusarium fujikuroi isolated from a male patient with acute myeloid leukemia.,https://www.ncbi.nlm.nih.gov/pmc/articles/PMC6013642/,"genome, isolate, isolated"
"Draft Genome Sequence of Solibacillus kalamii, Isolated from an Air Filter Aboard the International Space Station",https://www.ncbi.nlm.nih.gov/pmc/articles/PMC5578834/,"station, international, filter"
Detection of antimicrobial resistance genes associated with the International Space Station environmental surfaces,https://www.ncbi.nlm.nih.gov/pmc/articles/PMC9241228/,"surfaces, associated, resistance"
Draft genome sequences of two Fusarium oxysporum isolates cultured from infected Zinnia hybrida plants grown on the International Space Station.,https://www.ncbi.nlm.nih.gov/pmc/articles/PMC5958250/,"sequences, plants, space"
Characterization of Aspergillus niger Isolated from the International Space Station,https://www.ncbi.nlm.nih.gov/pmc/articles/PMC7326050/,"characterization, space, niger"
Multi-drug resistant Enterobacter bugandensis species isolated from the International Space Station and comparative genomic analyses with human pathogenic strains,https://www.ncbi.nlm.nih.gov/pmc/articles/PMC6251167/,"comparative, strains, human"
Succession and persistence of microbial communities and antimicrobial resistance genes associated with International Space Station environmental surfaces,https://www.ncbi.nlm.nih.gov/pmc/articles/PMC6280456/,"microbial, succession, surfaces"
"International Space Station conditions alter genomics, proteomics, and metabolomics in Aspergillus nidulans.",https://www.ncbi.nlm.nih.gov/pmc/articles/PMC9098231/,"nidulans, space, proteomics"
Proteomic characterization of Aspergillus fumigatus isolated from air and surfaces of the International Space Station.,https://www.ncbi.nlm.nih.gov/pmc/articles/PMC9116463/,"isolated, fumigatus, characterization"
Genomic Characterization and Virulence Potential of Two Fusarium oxysporum Isolates Cultured from the International Space Station,https://www.ncbi.nlm.nih.gov/pmc/articles/PMC6426649/,"cultured, international, virulence"
Characterization of the total and viable bacterial and fungal communities associated with the International Space Station surfaces.,https://www.ncbi.nlm.nih.gov/pmc/articles/PMC6452512/,"total, space, bacterial"
Proteomic and Metabolomic Characteristics of Extremophilic Fungi Under Simulated Mars Conditions.,https://www.ncbi.nlm.nih.gov/pmc/articles/PMC6529585/,"simulated, under, metabolomic"
MetaMiner: A Scalable Peptidogenomics Approach for Discovery of Ribosomal Peptide Natural Products with Blind Modifications from Microbial Communities,https://www.ncbi.nlm.nih.gov/pmc/articles/PMC6952069/,"blind, approach, peptidogenomics"
Draft Genome Sequences of Sphingomonas Species Associated with the International Space Station,https://www.ncbi.nlm.nih.gov/pmc/articles/PMC7303416/,"genome, station, space"
Draft Genome Sequences of Tremellomycetes Strains Isolated from the International Space Station,https://www.ncbi.nlm.nih.gov/pmc/articles/PMC7317102/,"station, draft, tremellomycetes"
Draft Genome Sequences of Rhodotorula mucilaginosa Strains Isolated from the International Space Station,https://www.ncbi.nlm.nih.gov/pmc/articles/PMC7393961/,"international, mucilaginosa, rhodotorula"
Draft Genome Sequences of Enterobacteriales Strains Isolated from the International Space Station,https://www.ncbi.nlm.nih.gov/pmc/articles/PMC7484075/,"sequences, strains, draft"
Draft Genome Sequences of Lactobacillales Isolated from the International Space Station,https://www.ncbi.nlm.nih.gov/pmc/articles/PMC7516158/,"isolated, space, lactobacillales"
Draft Genome Sequences of Klebsiella Species Isolated from the International Space Station,https://www.ncbi.nlm.nih.gov/pmc/articles/PMC7561690/,"space, international, draft"
Draft Genome Sequences of Bacillaceae Strains Isolated from the International Space Station.,https://www.ncbi.nlm.nih.gov/pmc/articles/PMC7595942/,"genome, station, isolated"
Assessing the risk of transfer of microorganisms at the International Space Station due to cargo delivery by commercial resupply vehicles,https://www.ncbi.nlm.nih.gov/pmc/articles/PMC7677455/,"commercial, risk, vehicles"
"Methylobacterium ajmalii sp. nov., isolated from the International Space Station",https://www.ncbi.nlm.nih.gov/pmc/articles/PMC8005752/,"space, isolated, international"
Draft Genome Sequences of Aspergillus and Penicillium Species Isolated from the International Space Station and Crew Resupply Vehicle Capsule,https://www.ncbi.nlm.nih.gov/pmc/articles/PMC8104057/,"aspergillus, capsule, isolated"
Advances in Space Microbiology,https://www.ncbi.nlm.nih.gov/pmc/articles/PMC12034939/,"advances, microbiology, space"
Effects of simulated microgravity on the proteome and secretome of the polyextremotolerant black fungus Knufia chersonesos.,https://www.ncbi.nlm.nih.gov/pmc/articles/PMC8012687/,"black, fungus, microgravity"
Draft Genome Sequences of Various Bacterial Phyla Isolated from the International Space Station,https://www.ncbi.nlm.nih.gov/pmc/articles/PMC8086211/,"international, draft, bacterial"
Evaluating the lettuce metatranscriptome with MinION sequencing for future spaceflight food production applications,https://www.ncbi.nlm.nih.gov/pmc/articles/PMC8211661/,"metatranscriptome, minion, lettuce"
